{
  "schema_version": "melissa.skill-version/v1",
  "pin": {
    "skill_id": "melissa.code.skill.backend-effects",
    "semantic_version": "1.0.0",
    "content_digest": "blake3:02971a0cec3b2895a553fe72af9180284b8290e9b2856956978dde49dc40081c"
  },
  "definition_digest": "blake3:a2b2b90519711446558d4fc082d7a6f15388fb304fd31a8b0ad54a394369abbc",
  "publisher_id": "melissa-local-development",
  "state": "tested",
  "required_capabilities": [
    "workspace.read"
  ],
  "evaluation_digest": null,
  "review_artifact_ref": null,
  "signature": null,
  "revocation_ref": null,
  "rollback_to": null
}