{
  "schema_version": "melissa.skill-version/v1",
  "pin": {
    "skill_id": "melissa.code.skill.requirements-design",
    "semantic_version": "1.0.0",
    "content_digest": "blake3:9bf8d3acf21151facb0fb390320e0155b79edaf21a46e3ad05b4b18be463241e"
  },
  "definition_digest": "blake3:2fa7b9a8c38cd58294011300c556b81318633ae9b6c1402fa0c1af8cbf45b41c",
  "publisher_id": "melissa-local-development",
  "state": "tested",
  "required_capabilities": [
    "workspace.read"
  ],
  "evaluation_digest": null,
  "review_artifact_ref": null,
  "signature": null,
  "revocation_ref": null,
  "rollback_to": null
}